[
  {
    "case_id": "E1-046",
    "category": "EXPLICIT_DIMENSION",
    "source": "REAL_BUSINESS",
    "severity": "CRITICAL",
    "question": "Total sales for Chennai city",
    "conversation": [],
    "datasource_ref": "Chatbot",
    "expected": {
      "metrics": [
        "C Y"
      ],
      "dimensions": [
        "City"
      ],
      "values": [
        "CHENNAI"
      ],
      "status": "WEAK_AMBIGUITY",
      "followup_context_applied": false,
      "dominant_candidate": null,
      "retrieval_status": "COMPLETE"
    },
    "notes": "Explicit 'city' qualifier disambiguates Chennai to City dimension."
  },
  {
    "case_id": "E1-047",
    "category": "EXPLICIT_DIMENSION",
    "source": "REAL_BUSINESS",
    "severity": "CRITICAL",
    "question": "Total sales in Coimbatore city",
    "conversation": [],
    "datasource_ref": "Chatbot",
    "expected": {
      "metrics": [
        "C Y"
      ],
      "dimensions": [
        "City"
      ],
      "values": [
        "COIMBATORE"
      ],
      "status": "WEAK_AMBIGUITY",
      "followup_context_applied": false,
      "dominant_candidate": null,
      "retrieval_status": "COMPLETE"
    },
    "notes": "Explicit 'city' qualifier disambiguates Coimbatore to City dimension."
  },
  {
    "case_id": "E1-048",
    "category": "EXPLICIT_DIMENSION",
    "source": "REAL_BUSINESS",
    "severity": "CRITICAL",
    "question": "Total sales for Madurai city",
    "conversation": [],
    "datasource_ref": "Chatbot",
    "expected": {
      "metrics": [
        "C Y"
      ],
      "dimensions": [
        "City"
      ],
      "values": [
        "MADURAI"
      ],
      "status": "WEAK_AMBIGUITY",
      "followup_context_applied": false,
      "dominant_candidate": null,
      "retrieval_status": "COMPLETE"
    },
    "notes": "Explicit 'city' qualifier disambiguates Madurai to City dimension."
  },
  {
    "case_id": "E1-049",
    "category": "EXPLICIT_DIMENSION",
    "source": "REAL_BUSINESS",
    "severity": "HIGH",
    "question": "Show sales for Erode city",
    "conversation": [],
    "datasource_ref": "Chatbot",
    "expected": {
      "metrics": [
        "C Y"
      ],
      "dimensions": [
        "City"
      ],
      "values": [
        "ERODE"
      ],
      "status": "WEAK_AMBIGUITY",
      "followup_context_applied": false,
      "dominant_candidate": null,
      "retrieval_status": "COMPLETE"
    },
    "notes": "Explicit 'city' qualifier disambiguates Erode to City dimension."
  },
  {
    "case_id": "E1-050",
    "category": "EXPLICIT_DIMENSION",
    "source": "REAL_BUSINESS",
    "severity": "HIGH",
    "question": "Qty in Salem city",
    "conversation": [],
    "datasource_ref": "Chatbot",
    "expected": {
      "metrics": [
        "Qty"
      ],
      "dimensions": [
        "City"
      ],
      "values": [
        "SALEM"
      ],
      "status": "WEAK_AMBIGUITY",
      "followup_context_applied": false,
      "dominant_candidate": null,
      "retrieval_status": "COMPLETE"
    },
    "notes": "Explicit 'city' qualifier disambiguates Salem to City dimension."
  },
  {
    "case_id": "E1-051",
    "category": "EXPLICIT_DIMENSION",
    "source": "REAL_BUSINESS",
    "severity": "HIGH",
    "question": "Show Qty for Tirunelveli city",
    "conversation": [],
    "datasource_ref": "Chatbot",
    "expected": {
      "metrics": [
        "Qty"
      ],
      "dimensions": [
        "City"
      ],
      "values": [
        "TIRUNELVELI"
      ],
      "status": "WEAK_AMBIGUITY",
      "followup_context_applied": false,
      "dominant_candidate": null,
      "retrieval_status": "COMPLETE"
    },
    "notes": "Explicit 'city' qualifier disambiguates Tirunelveli to City dimension."
  },
  {
    "case_id": "E1-052",
    "category": "EXPLICIT_DIMENSION",
    "source": "REAL_BUSINESS",
    "severity": "CRITICAL",
    "question": "Total sales for Chennai district",
    "conversation": [],
    "datasource_ref": "Chatbot",
    "expected": {
      "metrics": [
        "C Y"
      ],
      "dimensions": [
        "District"
      ],
      "values": [
        "CHENNAI"
      ],
      "status": "WEAK_AMBIGUITY",
      "followup_context_applied": false,
      "dominant_candidate": null,
      "retrieval_status": "COMPLETE"
    },
    "notes": "Explicit 'district' qualifier disambiguates Chennai to District dimension."
  },
  {
    "case_id": "E1-053",
    "category": "EXPLICIT_DIMENSION",
    "source": "REAL_BUSINESS",
    "severity": "CRITICAL",
    "question": "Total sales in Coimbatore district",
    "conversation": [],
    "datasource_ref": "Chatbot",
    "expected": {
      "metrics": [
        "C Y"
      ],
      "dimensions": [
        "District"
      ],
      "values": [
        "COIMBATORE"
      ],
      "status": "WEAK_AMBIGUITY",
      "followup_context_applied": false,
      "dominant_candidate": null,
      "retrieval_status": "COMPLETE"
    },
    "notes": "Explicit 'district' qualifier disambiguates Coimbatore to District dimension."
  },
  {
    "case_id": "E1-054",
    "category": "EXPLICIT_DIMENSION",
    "source": "REAL_BUSINESS",
    "severity": "CRITICAL",
    "question": "Total Qty for Madurai district",
    "conversation": [],
    "datasource_ref": "Chatbot",
    "expected": {
      "metrics": [
        "Qty"
      ],
      "dimensions": [
        "District"
      ],
      "values": [
        "MADURAI"
      ],
      "status": "WEAK_AMBIGUITY",
      "followup_context_applied": false,
      "dominant_candidate": null,
      "retrieval_status": "COMPLETE"
    },
    "notes": "Explicit 'district' qualifier disambiguates Madurai to District dimension."
  },
  {
    "case_id": "E1-055",
    "category": "EXPLICIT_DIMENSION",
    "source": "REAL_BUSINESS",
    "severity": "CRITICAL",
    "question": "Show sales for Ramraj brand",
    "conversation": [],
    "datasource_ref": "Chatbot",
    "expected": {
      "metrics": [
        "C Y"
      ],
      "dimensions": [
        "Brand"
      ],
      "values": [
        "RAMRAJ"
      ],
      "status": "WEAK_AMBIGUITY",
      "followup_context_applied": false,
      "dominant_candidate": null,
      "retrieval_status": "COMPLETE"
    },
    "notes": "Explicit 'brand' qualifier disambiguates Ramraj to Brand dimension."
  },
  {
    "case_id": "E1-056",
    "category": "EXPLICIT_DIMENSION",
    "source": "REAL_BUSINESS",
    "severity": "CRITICAL",
    "question": "Qty for brand Ramraj",
    "conversation": [],
    "datasource_ref": "Chatbot",
    "expected": {
      "metrics": [
        "Qty"
      ],
      "dimensions": [
        "Brand"
      ],
      "values": [
        "RAMRAJ"
      ],
      "status": "WEAK_AMBIGUITY",
      "followup_context_applied": false,
      "dominant_candidate": null,
      "retrieval_status": "COMPLETE"
    },
    "notes": "Explicit 'brand' prefix qualifier disambiguates Ramraj to Brand dimension."
  },
  {
    "case_id": "E1-057",
    "category": "EXPLICIT_DIMENSION",
    "source": "REAL_BUSINESS",
    "severity": "HIGH",
    "question": "Show quantity for Ramraj brand",
    "conversation": [],
    "datasource_ref": "Chatbot",
    "expected": {
      "metrics": [
        "Qty"
      ],
      "dimensions": [
        "Brand"
      ],
      "values": [
        "RAMRAJ"
      ],
      "status": "WEAK_AMBIGUITY",
      "followup_context_applied": false,
      "dominant_candidate": null,
      "retrieval_status": "COMPLETE"
    },
    "notes": "Explicit 'brand' qualifier with Qty metric."
  },
  {
    "case_id": "E1-058",
    "category": "EXPLICIT_DIMENSION",
    "source": "REAL_BUSINESS",
    "severity": "HIGH",
    "question": "Show sales for Viveagham brand",
    "conversation": [],
    "datasource_ref": "Chatbot",
    "expected": {
      "metrics": [
        "C Y"
      ],
      "dimensions": [
        "Brand"
      ],
      "values": [
        "VIVEAGHAM"
      ],
      "status": "WEAK_AMBIGUITY",
      "followup_context_applied": false,
      "dominant_candidate": null,
      "retrieval_status": "COMPLETE"
    },
    "notes": "Explicit 'brand' qualifier disambiguates Viveagham to Brand dimension."
  },
  {
    "case_id": "E1-059",
    "category": "EXPLICIT_DIMENSION",
    "source": "REAL_BUSINESS",
    "severity": "HIGH",
    "question": "Show sales of Marketing category",
    "conversation": [],
    "datasource_ref": "Chatbot",
    "expected": {
      "metrics": [
        "C Y"
      ],
      "dimensions": [
        "Category"
      ],
      "values": [
        "MARKETING",
        "MARKETING",
        "MARKETING"
      ],
      "status": "WEAK_AMBIGUITY",
      "followup_context_applied": false,
      "dominant_candidate": null,
      "retrieval_status": "COMPLETE"
    },
    "notes": "Explicit 'category' qualifier for Marketing category."
  },
  {
    "case_id": "E1-060",
    "category": "EXPLICIT_DIMENSION",
    "source": "REAL_BUSINESS",
    "severity": "HIGH",
    "question": "Pending amount for Franchise category",
    "conversation": [],
    "datasource_ref": "Chatbot",
    "expected": {
      "metrics": [
        "pendamt"
      ],
      "dimensions": [
        "Category"
      ],
      "values": [
        "FRANCHISEE",
        "FRANCHISEE",
        "FRANCHISEE"
      ],
      "status": "STRONG_AMBIGUITY",
      "followup_context_applied": false,
      "dominant_candidate": null,
      "retrieval_status": "COMPLETE"
    },
    "notes": "Explicit 'category' qualifier with pendamt metric."
  },
  {
    "case_id": "E1-061",
    "category": "EXPLICIT_DIMENSION",
    "source": "REAL_BUSINESS",
    "severity": "HIGH",
    "question": "Show Qty for Marketing category",
    "conversation": [],
    "datasource_ref": "Chatbot",
    "expected": {
      "metrics": [
        "Qty"
      ],
      "dimensions": [
        "Category"
      ],
      "values": [
        "MARKETING",
        "MARKETING",
        "MARKETING"
      ],
      "status": "WEAK_AMBIGUITY",
      "followup_context_applied": false,
      "dominant_candidate": null,